{
  "$schema": "https://json-schema.org/draft/2020-12/schema",
  "additionalProperties": false,
  "properties": {
    "checkpointId": {
      "pattern": "^ckp_[0-9a-hjkmnp-tv-z]{26}$",
      "type": "string"
    },
    "computerId": {
      "pattern": "^cmp_[0-9a-hjkmnp-tv-z]{26}$",
      "type": "string"
    },
    "createdAt": {
      "format": "date-time",
      "pattern": "^(?:(?:\\d\\d[2468][048]|\\d\\d[13579][26]|\\d\\d0[48]|[02468][048]00|[13579][26]00)-02-29|\\d{4}-(?:(?:0[13578]|1[02])-(?:0[1-9]|[12]\\d|3[01])|(?:0[469]|11)-(?:0[1-9]|[12]\\d|30)|(?:02)-(?:0[1-9]|1\\d|2[0-8])))T(?:(?:[01]\\d|2[0-3]):[0-5]\\d:[0-5]\\d(?:\\.\\d+)?(?:Z))$",
      "type": "string"
    },
    "files": {
      "additionalProperties": false,
      "properties": {
        ".claude/.credentials.json": {
          "oneOf": [
            {
              "additionalProperties": false,
              "properties": {
                "copyOrder": {
                  "maximum": 9007199254740991,
                  "minimum": 1,
                  "type": "integer"
                },
                "sha256": {
                  "pattern": "^[0-9a-f]{64}$",
                  "type": "string"
                },
                "size": {
                  "maximum": 65536,
                  "minimum": 0,
                  "type": "integer"
                },
                "state": {
                  "const": "present",
                  "type": "string"
                }
              },
              "required": [
                "state",
                "size",
                "sha256",
                "copyOrder"
              ],
              "type": "object"
            },
            {
              "additionalProperties": false,
              "properties": {
                "copyOrder": {
                  "maximum": 9007199254740991,
                  "minimum": 1,
                  "type": "integer"
                },
                "state": {
                  "const": "tombstone",
                  "type": "string"
                }
              },
              "required": [
                "state",
                "copyOrder"
              ],
              "type": "object"
            }
          ]
        },
        ".claude/.device-keys.json": {
          "oneOf": [
            {
              "additionalProperties": false,
              "properties": {
                "copyOrder": {
                  "maximum": 9007199254740991,
                  "minimum": 1,
                  "type": "integer"
                },
                "sha256": {
                  "pattern": "^[0-9a-f]{64}$",
                  "type": "string"
                },
                "size": {
                  "maximum": 65536,
                  "minimum": 0,
                  "type": "integer"
                },
                "state": {
                  "const": "present",
                  "type": "string"
                }
              },
              "required": [
                "state",
                "size",
                "sha256",
                "copyOrder"
              ],
              "type": "object"
            },
            {
              "additionalProperties": false,
              "properties": {
                "copyOrder": {
                  "maximum": 9007199254740991,
                  "minimum": 1,
                  "type": "integer"
                },
                "state": {
                  "const": "tombstone",
                  "type": "string"
                }
              },
              "required": [
                "state",
                "copyOrder"
              ],
              "type": "object"
            }
          ]
        },
        ".codex/.credentials.json": {
          "oneOf": [
            {
              "additionalProperties": false,
              "properties": {
                "copyOrder": {
                  "maximum": 9007199254740991,
                  "minimum": 1,
                  "type": "integer"
                },
                "sha256": {
                  "pattern": "^[0-9a-f]{64}$",
                  "type": "string"
                },
                "size": {
                  "maximum": 65536,
                  "minimum": 0,
                  "type": "integer"
                },
                "state": {
                  "const": "present",
                  "type": "string"
                }
              },
              "required": [
                "state",
                "size",
                "sha256",
                "copyOrder"
              ],
              "type": "object"
            },
            {
              "additionalProperties": false,
              "properties": {
                "copyOrder": {
                  "maximum": 9007199254740991,
                  "minimum": 1,
                  "type": "integer"
                },
                "state": {
                  "const": "tombstone",
                  "type": "string"
                }
              },
              "required": [
                "state",
                "copyOrder"
              ],
              "type": "object"
            }
          ]
        },
        ".codex/auth.json": {
          "oneOf": [
            {
              "additionalProperties": false,
              "properties": {
                "copyOrder": {
                  "maximum": 9007199254740991,
                  "minimum": 1,
                  "type": "integer"
                },
                "sha256": {
                  "pattern": "^[0-9a-f]{64}$",
                  "type": "string"
                },
                "size": {
                  "maximum": 65536,
                  "minimum": 0,
                  "type": "integer"
                },
                "state": {
                  "const": "present",
                  "type": "string"
                }
              },
              "required": [
                "state",
                "size",
                "sha256",
                "copyOrder"
              ],
              "type": "object"
            },
            {
              "additionalProperties": false,
              "properties": {
                "copyOrder": {
                  "maximum": 9007199254740991,
                  "minimum": 1,
                  "type": "integer"
                },
                "state": {
                  "const": "tombstone",
                  "type": "string"
                }
              },
              "required": [
                "state",
                "copyOrder"
              ],
              "type": "object"
            }
          ]
        }
      },
      "required": [
        ".claude/.credentials.json",
        ".claude/.device-keys.json",
        ".codex/auth.json",
        ".codex/.credentials.json"
      ],
      "type": "object"
    },
    "formatVersion": {
      "maximum": 9007199254740991,
      "minimum": 1,
      "type": "integer"
    },
    "generation": {
      "maximum": 9007199254740991,
      "minimum": 0,
      "type": "integer"
    },
    "object": {
      "additionalProperties": false,
      "properties": {
        "key": {
          "pattern": "^credentials\\/cmp_[0-9a-hjkmnp-tv-z]{26}\\/ckp_[0-9a-hjkmnp-tv-z]{26}\\.json$",
          "type": "string"
        },
        "sha256": {
          "pattern": "^[0-9a-f]{64}$",
          "type": "string"
        },
        "size": {
          "maximum": 9007199254740991,
          "minimum": 1,
          "type": "integer"
        }
      },
      "required": [
        "key",
        "size",
        "sha256"
      ],
      "type": "object"
    },
    "order": {
      "maximum": 9007199254740991,
      "minimum": 1,
      "type": "integer"
    }
  },
  "required": [
    "formatVersion",
    "checkpointId",
    "computerId",
    "generation",
    "order",
    "createdAt",
    "object",
    "files"
  ],
  "title": "CredentialManifest",
  "type": "object"
}
